{
  "runtime_command_id": "runtime-command:remote-1",
  "intent_fingerprint": "sha256:aaaaaaaaaaaaaaaaaaaaaaaaaaaaaaaaaaaaaaaaaaaaaaaaaaaaaaaaaaaaaaaa",
  "target_execution_space_id": "space-b",
  "canonical_command_intent": {
    "id": "runtime-command:remote-1",
    "target_execution_space_id": "space-b",
    "command": "resume_session",
    "idempotency_key": "remote-runtime-1",
    "expected_version": 4,
    "expires_unix_ms": 90000,
    "payload": {"session_id": "session-b", "session_generation": 3},
    "payload_fingerprint": "sha256:aaaaaaaaaaaaaaaaaaaaaaaaaaaaaaaaaaaaaaaaaaaaaaaaaaaaaaaaaaaaaaaa",
    "issued_at": "unix-ms:100"
  }
}
